{
  "schemaVersion": 1,
  "kind": "bxdl-runtime-lock",
  "vendor": "Eclipse Adoptium Temurin",
  "version": "21.0.12.1+1-LTS",
  "platform": {
    "os": "darwin",
    "arch": "arm64",
    "javaMajor": 21
  },
  "archive": {
    "name": "OpenJDK21U-jre_aarch64_mac_hotspot_21.0.12.1_1.tar.gz",
    "url": "https://github.com/adoptium/temurin21-binaries/releases/download/jdk-21.0.12.1%2B1/OpenJDK21U-jre_aarch64_mac_hotspot_21.0.12.1_1.tar.gz",
    "sha256": "dec50fc6f9fcd4fe3ae8cabf5a5fa68f6afc48841f7698e468e9aa5d54beed84",
    "sizeBytes": 48144965
  },
  "sourceArchive": {
    "name": "OpenJDK21U-jdk-sources_21.0.12.1_1.tar.gz",
    "url": "https://github.com/adoptium/temurin21-binaries/releases/download/jdk-21.0.12.1%2B1/OpenJDK21U-jdk-sources_21.0.12.1_1.tar.gz",
    "sha256": "573057d03584ae793fb7ec9a14c76d826d9187a53efeefd99da47403a5308234",
    "sizeBytes": 115126841
  },
  "javaSha256": "9be1d0a740ff6502df1a762145e62860f5de4b7e17658d9cb9498da3acf9d16c",
  "files": [
    {
      "path": "NOTICE",
      "sha256": "c02756bcd9fa8191bf0fda4451bc018414dd44ee35bf09922c24377a475e4b5a",
      "size": 2400,
      "mode": 420
    },
    {
      "path": "bin/java",
      "sha256": "9be1d0a740ff6502df1a762145e62860f5de4b7e17658d9cb9498da3acf9d16c",
      "size": 70432,
      "mode": 493
    },
    {
      "path": "bin/jfr",
      "sha256": "0dc4445b9482b480ca5a5e9b6e171f8c9a04a310a19273c323b71753abba7a0e",
      "size": 70448,
      "mode": 493
    },
    {
      "path": "bin/jrunscript",
      "sha256": "a273976003d20d1f5b2c3fedfce894683b3252c77858e0aad4a2b50b785f0897",
      "size": 70464,
      "mode": 493
    },
    {
      "path": "bin/jwebserver",
      "sha256": "83b47b44c21784db3f19650b1ecce2e36f76e56755c20aaba9c2d91e9735f40e",
      "size": 70464,
      "mode": 493
    },
    {
      "path": "bin/keytool",
      "sha256": "17b50cf49c688935080bb39b3196494827577735d9240ef9178598df6dbe0911",
      "size": 70464,
      "mode": 493
    },
    {
      "path": "bin/rmiregistry",
      "sha256": "0fd9e9bec1badb4ae0aae451fb93ab2cd62f7ae7c1236d82a65f7c9927c77090",
      "size": 70464,
      "mode": 493
    },
    {
      "path": "conf/jaxp.properties",
      "sha256": "7d95c49465d0c836d608d02856d3b097934dfb5dc4bd2279affaf337d045b708",
      "size": 7302,
      "mode": 420
    },
    {
      "path": "conf/logging.properties",
      "sha256": "b62d2733ab99556b108a1951d894c5a8d76b1ac7a00c02c388f9eb9be046c56f",
      "size": 2732,
      "mode": 420
    },
    {
      "path": "conf/management/jmxremote.access",
      "sha256": "0c25d26ee212ca1e8c33f67c3c460d43fe849c3a1d23dbe341148517602b280c",
      "size": 3997,
      "mode": 420
    },
    {
      "path": "conf/management/jmxremote.password.template",
      "sha256": "0273b6a6b9e20e6ce54c5aee70164028e0395063b2b7d39060a40b6495543dbf",
      "size": 5690,
      "mode": 420
    },
    {
      "path": "conf/management/management.properties",
      "sha256": "07dffdd85b01c19bf46ca320a699aba48dd6b01043eb0bd6a9528c7993312bad",
      "size": 14988,
      "mode": 420
    },
    {
      "path": "conf/net.properties",
      "sha256": "2e070ed1d97052f0ce8771ed2ef74a38d7c260a45fde7a3682c8844e5fdf58a4",
      "size": 7441,
      "mode": 420
    },
    {
      "path": "conf/security/java.policy",
      "sha256": "d51bcab7ed301caeff3779a5e777e6019864cecee5e2abc102ef991b0de77af2",
      "size": 2294,
      "mode": 420
    },
    {
      "path": "conf/security/java.security",
      "sha256": "cf62c92ef0260bd0adca121fea4067aa7ac00675ab4ddccd75e62370165523d6",
      "size": 71413,
      "mode": 420
    },
    {
      "path": "conf/security/policy/README.txt",
      "sha256": "6da0747334b0fea7592fd92614b2bbc8b126535e129b1fee483774d914e98eb5",
      "size": 2390,
      "mode": 420
    },
    {
      "path": "conf/security/policy/limited/default_US_export.policy",
      "sha256": "758b930a526fc670ab7537f8c26321527050a31f5f42149a2dda623c56a0a1a9",
      "size": 146,
      "mode": 420
    },
    {
      "path": "conf/security/policy/limited/default_local.policy",
      "sha256": "2b2627548e61316150d47ffc3e6cad465ca05b3cccd4785eb7d21aa7baa0f441",
      "size": 647,
      "mode": 420
    },
    {
      "path": "conf/security/policy/limited/exempt_local.policy",
      "sha256": "8c3d7648abcd95a272ce12db870082937f4d7f6878d730d83cb7fbb31eb8b2c9",
      "size": 566,
      "mode": 420
    },
    {
      "path": "conf/security/policy/unlimited/default_US_export.policy",
      "sha256": "758b930a526fc670ab7537f8c26321527050a31f5f42149a2dda623c56a0a1a9",
      "size": 146,
      "mode": 420
    },
    {
      "path": "conf/security/policy/unlimited/default_local.policy",
      "sha256": "8d8a318e6d90dfd7e26612d2b6385aa704f686ca6134c551f8928418d92b851a",
      "size": 193,
      "mode": 420
    },
    {
      "path": "conf/sound.properties",
      "sha256": "299c2360b6155eb28990ec49cd21753f97e43442fe8fab03e04f3e213df43a66",
      "size": 1210,
      "mode": 420
    },
    {
      "path": "legal/java.base/ADDITIONAL_LICENSE_INFO",
      "sha256": "a69bce275ba7a3570af6579cb0f55682cd75fedfcd49e0e8e9022270c447c916",
      "size": 2114,
      "mode": 420
    },
    {
      "path": "legal/java.base/ASSEMBLY_EXCEPTION",
      "sha256": "75292f03bf23d3db7c985aecc191029b93883200721ed23ed34a2e601463df33",
      "size": 1514,
      "mode": 420
    },
    {
      "path": "legal/java.base/LICENSE",
      "sha256": "4b9abebc4338048a7c2dc184e9f800deb349366bdf28eb23c2677a77b4c87726",
      "size": 19274,
      "mode": 420
    },
    {
      "path": "legal/java.base/aes.md",
      "sha256": "45c6d4da48325edfbff3dcf71c704e504c057904435ed23c6d57046d551eb69d",
      "size": 1444,
      "mode": 420
    },
    {
      "path": "legal/java.base/asm.md",
      "sha256": "683be15695bd248272d60f5b7fbe5e126a935ea6bf231a624a9aa164733e1d1d",
      "size": 1582,
      "mode": 420
    },
    {
      "path": "legal/java.base/c-libutl.md",
      "sha256": "bef40679922d6fdfb7e4ddb223ad6722300f6054ba737bbf6188d60fcec517f9",
      "size": 1556,
      "mode": 420
    },
    {
      "path": "legal/java.base/cldr.md",
      "sha256": "19515e14a240e022640e95b61b5095127fa9690755950b4a2b0a02e783e08163",
      "size": 9601,
      "mode": 420
    },
    {
      "path": "legal/java.base/icu.md",
      "sha256": "1bf28459c6e0af9f3429f4f8becd1668d6544055f8df240277456bc4b3d8a752",
      "size": 30197,
      "mode": 420
    },
    {
      "path": "legal/java.base/public_suffix.md",
      "sha256": "861de1e4992a7d28f1de25c73cd50d26a94779ebd749c0643fecfa56442c3429",
      "size": 17783,
      "mode": 420
    },
    {
      "path": "legal/java.base/siphash.md",
      "sha256": "5a792b5a74ad2a5f3d6a7ad8b7a841116e58a772c18bc6e392320a365b222c76",
      "size": 8256,
      "mode": 420
    },
    {
      "path": "legal/java.base/unicode.md",
      "sha256": "6f72f10d166b2c2e8a395e03e734c5afc852b59aeca73ced124f6b9c96268d53",
      "size": 9078,
      "mode": 420
    },
    {
      "path": "legal/java.base/zlib.md",
      "sha256": "c9c70c36a1f0325e8788771906202d42ba6ab4205caca44ec0f665707e83226b",
      "size": 1010,
      "mode": 420
    },
    {
      "path": "legal/java.compiler/ADDITIONAL_LICENSE_INFO",
      "sha256": "a69bce275ba7a3570af6579cb0f55682cd75fedfcd49e0e8e9022270c447c916",
      "size": 2114,
      "mode": 420
    },
    {
      "path": "legal/java.compiler/ASSEMBLY_EXCEPTION",
      "sha256": "75292f03bf23d3db7c985aecc191029b93883200721ed23ed34a2e601463df33",
      "size": 1514,
      "mode": 420
    },
    {
      "path": "legal/java.compiler/LICENSE",
      "sha256": "4b9abebc4338048a7c2dc184e9f800deb349366bdf28eb23c2677a77b4c87726",
      "size": 19274,
      "mode": 420
    },
    {
      "path": "legal/java.datatransfer/ADDITIONAL_LICENSE_INFO",
      "sha256": "a69bce275ba7a3570af6579cb0f55682cd75fedfcd49e0e8e9022270c447c916",
      "size": 2114,
      "mode": 420
    },
    {
      "path": "legal/java.datatransfer/ASSEMBLY_EXCEPTION",
      "sha256": "75292f03bf23d3db7c985aecc191029b93883200721ed23ed34a2e601463df33",
      "size": 1514,
      "mode": 420
    },
    {
      "path": "legal/java.datatransfer/LICENSE",
      "sha256": "4b9abebc4338048a7c2dc184e9f800deb349366bdf28eb23c2677a77b4c87726",
      "size": 19274,
      "mode": 420
    },
    {
      "path": "legal/java.desktop/ADDITIONAL_LICENSE_INFO",
      "sha256": "a69bce275ba7a3570af6579cb0f55682cd75fedfcd49e0e8e9022270c447c916",
      "size": 2114,
      "mode": 420
    },
    {
      "path": "legal/java.desktop/ASSEMBLY_EXCEPTION",
      "sha256": "75292f03bf23d3db7c985aecc191029b93883200721ed23ed34a2e601463df33",
      "size": 1514,
      "mode": 420
    },
    {
      "path": "legal/java.desktop/LICENSE",
      "sha256": "4b9abebc4338048a7c2dc184e9f800deb349366bdf28eb23c2677a77b4c87726",
      "size": 19274,
      "mode": 420
    },
    {
      "path": "legal/java.desktop/colorimaging.md",
      "sha256": "04d61e3e8e71dd452ebe52008af5378d9f6640d14578aeb515dc5375973b0189",
      "size": 167,
      "mode": 420
    },
    {
      "path": "legal/java.desktop/freetype.md",
      "sha256": "553e804baecb7de7129d77c7259a6b70037d1893f1c600b41b35201695fb7758",
      "size": 30465,
      "mode": 420
    },
    {
      "path": "legal/java.desktop/giflib.md",
      "sha256": "206aab89ec75968e48a6a1ed6df7d8b9bfb7aea12cbe4c9345d93e5d97460a25",
      "size": 1689,
      "mode": 420
    },
    {
      "path": "legal/java.desktop/harfbuzz.md",
      "sha256": "5ec7cba7f8e7fc3a089213140aab6fa1b3bd5bf8a91bf8bddb3b8d315fc5f7d0",
      "size": 3629,
      "mode": 420
    },
    {
      "path": "legal/java.desktop/jpeg.md",
      "sha256": "c1dfb9719a71ad9f861f8728550542d681e25c8ef40e6393606e6e2a0c1d653a",
      "size": 3474,
      "mode": 420
    },
    {
      "path": "legal/java.desktop/lcms.md",
      "sha256": "843f9f6fa9c3f8109fcf4d5fe74caf7f2ae8e9bcd92238e4aff2d428c932b24b",
      "size": 2654,
      "mode": 420
    },
    {
      "path": "legal/java.desktop/libpng.md",